{
  "schema_version": "continuation-router.closeout-join.v1",
  "run_id": "20260730T192255Z-swu-tsgr-001-continuation-join",
  "source_swu_id": "SWU-TSGR-001",
  "source_receipt_ref": {
    "path": "arcanum/arcana/task-session/development/invoke-runs/20260730T170810Z-deterministic-governance-runner/work-pack/results/SWU-TSGR-001-RESULT.json",
    "sha256": "2eacd4c36c09abc9e920830bf3014136be21c3e1a158a7e453bf7ef87741619d"
  },
  "selected_owner_route": "invoke:refresh:apply-approved",
  "invoke_owner_receipt_ref": {
    "path": "arcanum/arcana/task-session/development/invoke-runs/20260730T170810Z-deterministic-governance-runner/work-pack/closeout/SWU-TSGR-001-INVOKE-OWNER-RECEIPT.json",
    "sha256": "61c520c4483e317d3a09fec878b433b549d38310c855b113bd4e78e241c3ab7b"
  },
  "owner_result": "pass",
  "validation": [
    "owner receipt schema pass",
    "owner receipt canonical digest pass",
    "route tuple exact-match pass",
    "joined owner result pass",
    "returned unique successor SWU-TSGR-002 without execution"
  ],
  "returned_next_route": "task-session:execute SWU-TSGR-002",
  "result": "pass",
  "receipt_digest": "b9ddf75a156a10e91e8d4c43f23459608ef066d05b781d72374792a0d87599e1"
}
